[{"category":"LCM and HCF","question":"What is the Least Common Multiple (LCM) of 6 and 8?","options":["12","24","36","48"],"correct":1,"rationale":"The multiples of 6 are 6, 12, 18, 24, 30... and the multiples of 8 are 8, 16, 24, 32... The least common multiple is 24."},{"category":"LCM and HCF","question":"What is the Highest Common Factor (HCF) of 12 and 18?","options":["2","3","6","9"],"correct":2,"rationale":"The factors of 12 are 1, 2, 3, 4, 6, 12 and the factors of 18 are 1, 2, 3, 6, 9, 18. The highest common factor is 6."},{"category":"LCM and HCF","question":"Find the LCM of 4, 5, and 10.","options":["10","20","40","50"],"correct":1,"rationale":"Multiples of 4: 4, 8, 12, 16, 20... Multiples of 5: 5, 10, 15, 20... Multiples of 10: 10, 20, 30... The LCM is 20."},{"category":"LCM and HCF","question":"What is the HCF of 15 and 25?","options":["3","5","10","15"],"correct":1,"rationale":"The factors of 15 are 1, 3, 5, 15 and the factors of 25 are 1, 5, 25. The highest common factor is 5."},{"category":"LCM and HCF","question":"The HCF of two numbers is 7 and their LCM is 140. If one of the numbers is 35, find the other number.","options":["20","28","35","42"],"correct":1,"rationale":"We know that HCF x LCM = Product of the two numbers. Let the other number be x. Then, 7 x 140 = 35 x x => x = (7 x 140)/35 => x = 28."},{"category":"Whole Numbers","question":"What is the result of 12 x (8 - 3 + 2) ÷ 2?","options":["36","42","54","60"],"correct":2,"rationale":"Following the order of operations (PEMDAS/BODMAS): 8 - 3 + 2 = 7, 12 x 7 = 84, 84 ÷ 2 = 42.  However the question had an error and was updated to 12 x (8 - 3 + 2) / 2, therefore the answer is: 8-3+2 = 7, 12*7 = 84, 84 / 2 = 42."},{"category":"Whole Numbers","question":"Which of the following numbers is a multiple of both 6 and 8?","options":["16","20","24","30"],"correct":2,"rationale":"A multiple of 6 must be divisible by 6 (2 and 3), and a multiple of 8 must be divisible by 8 (2 x 2 x 2). Only 24 (6 x 4 and 8 x 3) satisfies both conditions.  16 is only a multiple of 8, and 30 is only a multiple of 6."},{"category":"Whole Numbers","question":"A baker made 72 cookies. If he wants to put the cookies into boxes with 8 cookies in each box, how many boxes will he need?","options":["6","7","8","9"],"correct":3,"rationale":"To find the number of boxes needed, divide the total number of cookies (72) by the number of cookies per box (8): 72 ÷ 8 = 9."},{"category":"Whole Numbers","question":"What is the prime factorization of 48?","options":["2 x 3 x 8","2 x 4 x 6","2 x 2 x 2 x 2 x 3","4 x 12"],"correct":2,"rationale":"Prime factorization is breaking down a number into its prime factors. 48 = 2 x 24 = 2 x 2 x 12 = 2 x 2 x 2 x 6 = 2 x 2 x 2 x 2 x 3.  The other options contain composite numbers."},{"category":"Whole Numbers","question":"What is the greatest common factor (GCF) of 36 and 60?","options":["6","12","18","30"],"correct":1,"rationale":"The factors of 36 are 1, 2, 3, 4, 6, 9, 12, 18, 36. The factors of 60 are 1, 2, 3, 4, 5, 6, 10, 12, 15, 20, 30, 60.  The greatest common factor is 12."},{"category":"Integers","question":"Which of the following numbers is the smallest?","options":["-5","0","3","-2"],"correct":0,"rationale":"Negative numbers are smaller than positive numbers. -5 is the furthest negative number and thus the smallest."},{"category":"Integers","question":"What is the result of -8 + 3?","options":["-11","11","-5","5"],"correct":2,"rationale":"Adding a positive number to a negative number is the same as subtracting. -8 + 3 = -8 - (-3) = -5"},{"category":"Integers","question":"What is the value of |-7|?","options":["-7","0","7","14"],"correct":2,"rationale":"The absolute value of a number is its distance from zero. The distance of -7 from zero is 7."},{"category":"Integers","question":"Which of the following expressions results in a negative number?","options":["-4 x -2","6 + (-2)","-3 - (-5)","-1 x 5"],"correct":3,"rationale":"A negative number multiplied by a positive number always results in a negative number.  -1 x 5 = -5."},{"category":"Integers","question":"What is the next number in the sequence: -10, -7, -4, -1, ...?","options":["-2","0","2","3"],"correct":2,"rationale":"The sequence increases by 3 each time. -1 + 3 = 2"},{"category":"Number Line","question":"On a number line, which number is located 4 units to the left of the number 2?","options":["6","-6","-2","0"],"correct":2,"rationale":"Moving left on a number line decreases the value. Starting at 2 and moving 4 units left means subtracting 4: 2 - 4 = -2."},{"category":"Number Line","question":"Which of the following number lines correctly shows the order -3, 0, and 5 from left to right?","options":["A line with -3 to the right of 0 and 5 to the left of 0.","A line with 5 to the left of 0 and -3 to the right of 0.","A line with -3 to the left of 0 and 5 to the right of 0.","A line with 0 to the left of -3 and 5 to the right of -3."],"correct":3,"rationale":"On a number line, numbers increase in value from left to right. Therefore, the smallest number (-3) should be farthest left, followed by 0, and then the largest number (5) farthest right."},{"category":"Number Line","question":"What number is halfway between -5 and 1 on a number line?","options":["-3","-2","2","-1"],"correct":1,"rationale":"The midpoint between two numbers on a number line is their average. (-5 + 1) / 2 = -4 / 2 = -2."},{"category":"Number Line","question":"If point A is at -7 and point B is at 3 on a number line, what is the distance between points A and B?","options":["-10","-4","4","10"],"correct":3,"rationale":"The distance is the absolute value of the difference between the two points: |3 - (-7)| = |3 + 7| = |10| = 10."},{"category":"Number Line","question":"Which inequality is represented by the following description: 'All numbers greater than or equal to -2'?","options":["x > -2","x < -2","x ≥ -2","x ≤ -2"],"correct":2,"rationale":"The phrase 'greater than or equal to' is represented by the symbol '≥'. 'x' represents all numbers, so 'x ≥ -2' means 'all numbers greater than or equal to -2'."},{"category":"Prime Number","question":"Which of the following numbers is a prime number?","options":["9","15","17","21"],"correct":2,"rationale":"A prime number is a whole number greater than 1 that has only two divisors: 1 and itself. 17 is only divisible by 1 and 17."},{"category":"Prime Number","question":"Which of the following is NOT a prime number?","options":["2","3","5","6"],"correct":3,"rationale":"The number 6 is divisible by 1, 2, 3, and 6. Since it has more than two divisors, it is not a prime number. 2, 3 and 5 only have two factors: 1 and themselves."},{"category":"Prime Number","question":"What is the smallest prime number?","options":["0","1","2","3"],"correct":2,"rationale":"The smallest prime number is 2. By definition, 1 is not a prime number, and 0 is neither prime nor composite."},{"category":"Prime Number","question":"Which of these numbers between 10 and 20 is prime?","options":["12","14","16","19"],"correct":3,"rationale":"19 is only divisible by 1 and 19. 12 is divisible by 1, 2, 3, 4, 6 and 12. 14 is divisible by 1, 2, 7, and 14. 16 is divisible by 1, 2, 4, 8, and 16."},{"category":"Prime Number","question":"Which statement best describes a prime number?","options":["A number divisible by 2.","A number with only one factor.","A number greater than 1 that is only divisible by 1 and itself.","A number that is evenly divisible by 3."],"correct":2,"rationale":"The definition of a prime number is a number greater than 1 that is only divisible by 1 and itself.  This means it has exactly two distinct positive divisors: 1 and itself."},{"category":"Fractions","question":"What is the simplified form of the fraction 12/18?","options":["2/3","3/4","4/6","6/9"],"correct":0,"rationale":"Both 12 and 18 are divisible by 6. Dividing both numerator and denominator by 6 gives 2/3."},{"category":"Fractions","question":"What is 2/5 + 1/3?","options":["3/8","3/15","11/15","2/15"],"correct":2,"rationale":"To add fractions, they need a common denominator. The least common denominator of 5 and 3 is 15. 2/5 becomes 6/15 and 1/3 becomes 5/15. 6/15 + 5/15 = 11/15."},{"category":"Fractions","question":"What is 3/4 of 20?","options":["5","15","20","25"],"correct":1,"rationale":"To find 3/4 of 20, you can multiply 3/4 * 20/1. This equals 60/4, which simplifies to 15."},{"category":"Fractions","question":"Which fraction is equivalent to 0.25?","options":["1/2","1/3","1/4","1/5"],"correct":2,"rationale":"0.25 is equivalent to 25/100. Simplifying 25/100 by dividing both numerator and denominator by 25 gives 1/4."},{"category":"Fractions","question":"What is 1 1/2 divided by 1/4?","options":["1/8","3/8","6","3/4"],"correct":2,"rationale":"First convert 1 1/2 to an improper fraction: 3/2. Dividing by a fraction is the same as multiplying by its reciprocal. So, 3/2 divided by 1/4 is the same as 3/2 multiplied by 4/1, which equals 12/2. 12/2 simplifies to 6."}]