[
  {
    "category": "Algebra",
    "question": "Solve for x in the equation: 2x - 5 = 11",
    "options": ["x = 8", "x = 3", "x = -3", "x = 6"],
    "correct": 0,
    "rationale": "2x - 5 = 11 → 2x = 16 → x = 8"
  },
  {
    "category": "Algebra",
    "question": "Factorize: x² - 9",
    "options": ["(x-3)(x+3)", "(x-9)(x+1)", "(x-4.5)(x-4.5)", "(x-9)(x-1)"],
    "correct": 0,
    "rationale": "x² - 9 = x² - 3² = (x-3)(x+3)"
  },
  {
    "category": "Quadratic Equations",
    "question": "What are the roots of the quadratic equation x² - 5x + 6 = 0?",
    "options": ["x = 2, x = 3", "x = -2, x = -3", "x = 2, x = -3", "x = -2, x = 3"],
    "correct": 0,
    "rationale": "Using the factoring method: x² - 5x + 6 = 0 → (x-2)(x-3) = 0 → x = 2 or x = 3"
  },
  {
    "category": "Polynomials",
    "question": "If P(x) = x³ - 4x² + 5x - 2, then what is P(2)?",
    "options": ["0", "2", "4", "6"],
    "correct": 0,
    "rationale": "P(2) = 2³ - 4(2²) + 5(2) - 2 = 8 - 16 + 10 - 2 = 0"
  },
  {
    "category": "Coordinate Geometry",
    "question": "What is the distance between the points (3, 4) and (0, 0)?",
    "options": ["5", "7", "√25", "3"],
    "correct": 0,
    "rationale": "Distance = √[(3-0)² + (4-0)²] = √(9+16) = √25 = 5"
  },
  {
    "category": "Trigonometry",
    "question": "What is the value of sin(30°)?",
    "options": ["1/2", "√3/2", "0", "1"],
    "correct": 0,
    "rationale": "sin(30°) = 1/2"
  },
  {
    "category": "Statistics",
    "question": "What is the mean of the numbers 2, 4, 6, 8, 10?",
    "options": ["6", "5", "7", "8"],
    "correct": 1,
    "rationale": "Mean = (2+4+6+8+10)/5 = 30/5 = 6"
  },
  {
    "category": "Probability",
    "question": "When rolling a fair six-sided die, what is the probability of rolling an even number?",
    "options": ["1/2", "1/3", "2/3", "1/6"],
    "correct": 0,
    "rationale": "There are 3 even numbers (2, 4, 6) out of 6 possible outcomes, so the probability is 3/6 = 1/2"
  },
  {
    "category": "Mensuration",
    "question": "What is the volume of a sphere with radius 3 cm?",
    "options": ["36π cm³", "12π cm³", "9π cm³", "4π cm³"],
    "correct": 0,
    "rationale": "Volume of a sphere = (4/3)πr³ = (4/3)π(3)³ = (4/3)π(27) = 36π cm³"
  },
  {
    "category": "Circles",
    "question": "What is the equation of a circle with center at (2, 3) and radius 4?",
    "options": ["(x-2)² + (y-3)² = 16", "(x+2)² + (y+3)² = 16", "(x-2)² + (y-3)² = 4", "(x+2)² + (y+3)² = 4"],
    "correct": 0,
    "rationale": "The equation of a circle with center (h,k) and radius r is (x-h)² + (y-k)² = r². With center (2,3) and radius 4, we get (x-2)² + (y-3)² = 4² = 16"
  }
]
