[{"category":"Fractions","question":"Which fraction is equivalent to 2/3?","options":["3/4","4/6","6/12","1/2"],"correct":1,"rationale":"To find an equivalent fraction, multiply the numerator and denominator by the same number. 2 x 2 = 4 and 3 x 2 = 6, so 4/6 is equivalent to 2/3."},{"category":"Fractions","question":"What is 1/4 + 2/8?","options":["3/12","1/2","3/8","1/3"],"correct":1,"rationale":"First, find a common denominator. 1/4 is equivalent to 2/8. Then, add the numerators: 2/8 + 2/8 = 4/8. Simplify 4/8 to 1/2."},{"category":"Fractions","question":"John ate 1/3 of a pizza, and Mary ate 1/6 of the same pizza. How much of the pizza did they eat altogether?","options":["1/9","2/9","1/2","2/3"],"correct":2,"rationale":"First, find a common denominator for 1/3 and 1/6, which is 6. Convert 1/3 to 2/6. Then add the fractions: 2/6 + 1/6 = 3/6. Simplify 3/6 to 1/2."},{"category":"Fractions","question":"Which fraction is the largest?","options":["1/2","3/8","2/5","5/12"],"correct":0,"rationale":"Convert all fractions to have a common denominator, such as 120. 1/2 = 60/120, 3/8 = 45/120, 2/5 = 48/120, 5/12 = 50/120. Therefore, 1/2 is the largest."},{"category":"Fractions","question":"What is 3/4 x 2/5?","options":["5/9","6/20","5/20","1/2"],"correct":1,"rationale":"To multiply fractions, multiply the numerators and multiply the denominators: (3 x 2) / (4 x 5) = 6/20. This fraction can be simplified to 3/10, though that isn't one of the choices, indicating 6/20 is the correct answer."},{"category":"LCM and HCF","question":"What is the Least Common Multiple (LCM) of 4 and 6?","options":["8","12","10","24"],"correct":1,"rationale":"The multiples of 4 are 4, 8, 12, 16... and the multiples of 6 are 6, 12, 18... The smallest number that appears in both lists is 12."},{"category":"LCM and HCF","question":"What is the Highest Common Factor (HCF) of 12 and 18?","options":["3","9","6","36"],"correct":2,"rationale":"The factors of 12 are 1, 2, 3, 4, 6, 12 and the factors of 18 are 1, 2, 3, 6, 9, 18. The largest number that appears in both lists is 6."},{"category":"LCM and HCF","question":"Find the LCM of 5 and 10.","options":["5","1","15","10"],"correct":3,"rationale":"The multiples of 5 are 5, 10, 15... and the multiples of 10 are 10, 20, 30... The smallest number that appears in both lists is 10."},{"category":"LCM and HCF","question":"Which of these pairs of numbers has an HCF of 1?","options":["4 and 8","6 and 9","5 and 7","10 and 15"],"correct":2,"rationale":"Numbers with an HCF of 1 are called co-prime numbers. The only factors of 5 are 1 and 5, and the only factors of 7 are 1 and 7. Therefore, their HCF is 1."},{"category":"LCM and HCF","question":"What is the LCM of 2, 3, and 4?","options":["6","12","24","8"],"correct":1,"rationale":"Multiples of 2: 2, 4, 6, 8, 10, 12...\nMultiples of 3: 3, 6, 9, 12...\nMultiples of 4: 4, 8, 12... The least common multiple is 12."},{"category":"Whole Numbers","question":"What is the value of 12 x (5 + 3) - 6?","options":["90","96","94","102"],"correct":0,"rationale":"Using the order of operations (PEMDAS/BODMAS): 1. Parentheses: 5 + 3 = 8. 2. Multiplication: 12 x 8 = 96. 3. Subtraction: 96 - 6 = 90."},{"category":"Whole Numbers","question":"Which of the following numbers is a multiple of both 6 and 8?","options":["18","24","30","36"],"correct":1,"rationale":"A multiple of 6 is any number that can be divided evenly by 6. Multiples of 6 include 6, 12, 18, 24, 30, 36,... A multiple of 8 is any number that can be divided evenly by 8. Multiples of 8 include 8, 16, 24, 32, 40,... The first common multiple of both 6 and 8 is 24."},{"category":"Whole Numbers","question":"What is the prime factorization of 48?","options":["2 x 3 x 8","2 x 2 x 2 x 2 x 3","4 x 12","2 x 2 x 2 x 6"],"correct":1,"rationale":"Prime factorization breaks a number down into its prime factors. 48 = 2 x 24 = 2 x 2 x 12 = 2 x 2 x 2 x 6 = 2 x 2 x 2 x 2 x 3. Therefore, the prime factorization of 48 is 2 x 2 x 2 x 2 x 3 or 2⁴ x 3."},{"category":"Whole Numbers","question":"Which of these numbers is a prime number?","options":["9","15","19","21"],"correct":2,"rationale":"A prime number is a whole number greater than 1 that has only two divisors: 1 and itself. 9 is divisible by 1, 3, and 9. 15 is divisible by 1, 3, 5, and 15. 19 is only divisible by 1 and 19. 21 is divisible by 1, 3, 7, and 21. Therefore, 19 is the only prime number in the list."},{"category":"Whole Numbers","question":"What is the result when 75 is divided by 5?","options":["12","15","20","25"],"correct":1,"rationale":"Division is the inverse operation of multiplication. Since 5 x 15 = 75, then 75 / 5 = 15."},{"category":"Integers","question":"Which of the following integers is the greatest?","options":["-5","0","-12","4"],"correct":3,"rationale":"Positive integers are always greater than zero and negative integers. 4 is the only positive integer listed."},{"category":"Integers","question":"What is the opposite of -7?","options":["7","-7","0","1/7"],"correct":0,"rationale":"The opposite of a negative integer is the positive version of that integer. The opposite of -7 is 7."},{"category":"Integers","question":"Which of the following statements is true?","options":["-3 > 2","-1 > -5","0 < -4","5 < -1"],"correct":1,"rationale":"-1 is closer to 0 than -5 on the number line, so -1 is greater than -5. -1 > -5 is true."},{"category":"Integers","question":"What number is 8 units to the left of 2 on the number line?","options":["10","-6","6","-10"],"correct":1,"rationale":"Moving 8 units to the left of 2 means subtracting 8 from 2. 2 - 8 = -6"},{"category":"Integers","question":"What is the value of | -9 | + | 3 | ?","options":["-12","6","12","-6"],"correct":2,"rationale":"The absolute value of a number is its distance from zero. |-9| = 9 and |3| = 3. Therefore, 9 + 3 = 12."},{"category":"Number Line","question":"What number is located 3 units to the left of 2 on a number line?","options":["-1","5","-5","1"],"correct":0,"rationale":"Moving left on a number line represents subtracting. 2 - 3 = -1"},{"category":"Number Line","question":"Which number has the greatest absolute value on the number line segment from -5 to 3?","options":["-4","3","-5","0"],"correct":2,"rationale":"Absolute value is the distance from zero.  -5 is 5 units from zero, which is the greatest distance among the options."},{"category":"Number Line","question":"Point A is located at -2 and Point B is located at 4 on a number line. What is the distance between Point A and Point B?","options":["2","6","-6","-2"],"correct":1,"rationale":"To find the distance between two points, subtract the smaller number from the larger number: 4 - (-2) = 4 + 2 = 6"},{"category":"Number Line","question":"Which of the following inequalities is represented by the number line showing a closed circle at -1 and shading to the left?","options":["x > -1","x < -1","x ≥ -1","x ≤ -1"],"correct":3,"rationale":"A closed circle means 'equal to' is included. Shading to the left means 'less than'. Therefore, the inequality is x ≤ -1."},{"category":"Number Line","question":"Which of the following numbers is between -1/2 and 1/4 on the number line?","options":["-1","1/2","0","-3/4"],"correct":2,"rationale":"-1/2 is -0.5 and 1/4 is 0.25.  0 is between -0.5 and 0.25. The other options are either less than -0.5 or greater than 0.25."}]